Date,Currency,Campaign Name,Attribution type,Purchased ASIN,"14 Day Total Sales ",14 Day Total Orders (#),14 Day Total Units (#),14 Day New-to-brand Sales,14 Day New-to-brand Orders (#),14 Day New-to-brand Units (#),14 Day % of Sales New-to-brand,14 Day % of Orders New-to-brand,14 Day % of Units New-to-brand,Cost type,14 Day Total Sales - (Click),14 Day Total Orders (#) - (Click),14 Day Total Units (#) - (Click)
"Feb 2, 2026",USD,Brain Tea SB Bulk_banana leaf tea_$0.73_01021160,Promoted,B0824GK8BP,$83.07,3,3,$27.69,1,1,33.30%,33.30%,33.30%,CPC,$83.07,3,3
"Feb 2, 2026",USD,Brain Tea SB Bulk_tea_$0.73_01021160,Promoted,B0824GK8BP,$27.69,1,1,$27.69,1,1,100.00%,100.00%,100.00%,CPC,$27.69,1,1
"Feb 3, 2026",USD,Brain Tea SB Bulk_mct tea_$0.66_01021160,Promoted,B0824GK8BP,$27.69,1,1,$27.69,1,1,100.00%,100.00%,100.00%,CPC,$27.69,1,1
"Feb 5, 2026",USD,BTFM - B0824GK8BP - K5-JSC0-HUPB - SBV PT - Replication SKC - B0CV61W2TQ - 20251025 - MV,Promoted,B0824GK8BP,$55.38,2,2,$55.38,2,2,100.00%,100.00%,100.00%,CPC,$55.38,2,2
"Feb 5, 2026",USD,Brain Tea SB Bulk_memory tea_$0.66_01021160,Promoted,B0824GK8BP,$27.69,1,1,$0.0,0,0,0.00%,0.00%,0.00%,CPC,$27.69,1,1
"Feb 5, 2026",USD,Brain Tea SB Bulk_yerba mate tea bag_$0.66_01021160,Promoted,B0824GK8BP,$27.69,1,1,$27.69,1,1,100.00%,100.00%,100.00%,CPC,$27.69,1,1
"Feb 7, 2026",USD,Brain Tea SB Bulk_brain tea_$0.66_01021160,Promoted,B0824GK8BP,$27.69,1,1,$27.69,1,1,100.00%,100.00%,100.00%,CPC,$27.69,1,1
"Feb 7, 2026",USD,Brain Tea SB Bulk_focus tea_$0.66_01021160,Promoted,B0824GK8BP,$27.69,1,1,$27.69,1,1,100.00%,100.00%,100.00%,CPC,$27.69,1,1
"Feb 8, 2026",USD,Brain Tea SB Bulk_brain tea_$0.66_01021160,Promoted,B0824GK8BP,$27.69,1,1,$27.69,1,1,100.00%,100.00%,100.00%,CPC,$27.69,1,1
"Feb 9, 2026",USD,Brain Tea SB Bulk_brain tea_$0.66_01021160,Promoted,B0CRZRHT7R,$22.93,1,1,$22.93,1,1,100.00%,100.00%,100.00%,CPC,$22.93,1,1
"Feb 11, 2026",USD,Brain Tea SB Bulk_ginseng and ginkgo tea_$0.66_01021160,Promoted,B0824GK8BP,$27.69,1,1,$27.69,1,1,100.00%,100.00%,100.00%,CPC,$27.69,1,1
"Feb 11, 2026",USD,Brain Tea SB Bulk_brain tea blend_$0.73_01021160,Promoted,B0824GK8BP,$27.69,1,1,$27.69,1,1,100.00%,100.00%,100.00%,CPC,$27.69,1,1
"Feb 11, 2026",USD,BTFM - B0824GK8BP - K5-JSC0-HUPB - SBV PT - Replication SKC - B0CV61W2TQ - 20251025 - MV,Promoted,B0824GK8BP,$27.69,1,1,$0.0,0,0,0.00%,0.00%,0.00%,CPC,$27.69,1,1
"Feb 12, 2026",USD,Brain Tea SB New_lions mane cognitive tea_$0.77_01021170,Promoted,B0824GK8BP,$27.69,1,1,$27.69,1,1,100.00%,100.00%,100.00%,CPC,$27.69,1,1
"Feb 13, 2026",USD,Brain Tea SB Bulk_herbal tea for memory support_$0.73_01021160,Promoted,B0824GK8BP,$27.69,1,1,$27.69,1,1,100.00%,100.00%,100.00%,CPC,$27.69,1,1
"Feb 14, 2026",USD,Brain Tea SB New_anti brain fog tea_$0.77_01021170,Promoted,B0824GK8BP,$27.69,1,1,$27.69,1,1,100.00%,100.00%,100.00%,CPC,$27.69,1,1
"Feb 14, 2026",USD,Brain Tea SB Bulk_hocus focus herbal tea_$0.73_01021160,Promoted,B0824GK8BP,$27.69,1,1,$0.0,0,0,0.00%,0.00%,0.00%,CPC,$27.69,1,1
"Feb 15, 2026",USD,Brain Tea SB Bulk_all natural organic brain tea_$0.66_01021160,Promoted,B0824GK8BP,$27.69,1,1,$0.0,0,0,0.00%,0.00%,0.00%,CPC,$27.69,1,1
"Feb 15, 2026",USD,Brain Tea SB Bulk_focus tea_$0.66_01021160,Promoted,B0824GK8BP,$27.69,1,1,$27.69,1,1,100.00%,100.00%,100.00%,CPC,$27.69,1,1
"Feb 16, 2026",USD,Brain Tea SB Bulk_mct tea_$0.66_01021160,Promoted,B0824GK8BP,$27.69,1,1,$27.69,1,1,100.00%,100.00%,100.00%,CPC,$27.69,1,1
"Feb 16, 2026",USD,BTFM - B0824GK8BP - K5-JSC0-HUPB - SBV PT - Replication SKC - B0CV61W2TQ - 20251025 - MV,Promoted,B0824GK8BP,$27.69,1,1,$27.69,1,1,100.00%,100.00%,100.00%,CPC,$27.69,1,1
"Feb 17, 2026",USD,Brain Tea SB Bulk_brain tea_$0.66_01021160,Promoted,B0CRZRHT7R,$22.93,1,1,$0.0,0,0,0.00%,0.00%,0.00%,CPC,$22.93,1,1
"Feb 18, 2026",USD,SB_Brain Tea_uplifting brain tea_68_ERIC,Promoted,B0824GK8BP,$27.69,1,1,$27.69,1,1,100.00%,100.00%,100.00%,CPC,$27.69,1,1
"Feb 18, 2026",USD,Brain Tea SB Bulk_focus tea_$0.66_01021160,Promoted,B0CRZRHT7R,$22.43,1,1,$0.0,0,0,0.00%,0.00%,0.00%,CPC,$22.43,1,1
"Feb 18, 2026",USD,Brain Tea SB Bulk_daily herbal tea_$0.66_01021160,Promoted,B0CRZRHT7R,$22.43,1,1,$0.0,0,0,0.00%,0.00%,0.00%,CPC,$22.43,1,1
"Feb 21, 2026",USD,Brain Tea SB Bulk_ginseng and ginkgo tea_$0.66_01021160,Promoted,B0824GK8BP,$27.69,1,1,$0.0,0,0,0.00%,0.00%,0.00%,CPC,$27.69,1,1
"Feb 23, 2026",USD,SB_Brain Tea_cut and sifted brain tea_68_ERIC,Promoted,B0824GK8BP,$27.69,1,1,$27.69,1,1,100.00%,100.00%,100.00%,CPC,$27.69,1,1
"Feb 23, 2026",USD,BTF - B0824GK8BP - K5-JSC0-HUPB - SBV E - Rank SKC - lantana camara tea - 20250622 - MV,Promoted,B0824GK8BP,$27.69,1,1,$27.69,1,1,100.00%,100.00%,100.00%,CPC,$27.69,1,1
"Feb 23, 2026",USD,Brain Tea SB Bulk_ginseng and ginkgo tea_$0.66_01021160,Promoted,B0824GK8BP,$27.69,1,1,$0.0,0,0,0.00%,0.00%,0.00%,CPC,$27.69,1,1
"Feb 24, 2026",USD,SB_Brain Tea_bacopa leaf tea_68_ERIC,Promoted,B0824GK8BP,$27.69,1,1,$27.69,1,1,100.00%,100.00%,100.00%,CPC,$27.69,1,1
"Feb 24, 2026",USD,Brain Tea SB Bulk_mct tea_$0.66_01021160,Promoted,B0824GK8BP,$27.69,1,1,$27.69,1,1,100.00%,100.00%,100.00%,CPC,$27.69,1,1
"Feb 24, 2026",USD,Brain Tea SB Bulk_tea for brain support_$0.66_01021160,Promoted,B0CRZRHT7R,$19.93,1,1,$19.93,1,1,100.00%,100.00%,100.00%,CPC,$19.93,1,1
"Feb 26, 2026",USD,SB_Brain Tea_cognition tea mix_66_ERIC,Promoted,B0824GK8BP,$27.69,1,1,$27.69,1,1,100.00%,100.00%,100.00%,CPC,$27.69,1,1
"Feb 27, 2026",USD,Brain Tea SB Bulk_daily herbal tea_$0.66_01021160,Promoted,B0CRZRHT7R,$19.43,1,1,$19.43,1,1,100.00%,100.00%,100.00%,CPC,$19.43,1,1
"Feb 27, 2026",USD,Brain Tea SB New_brain tea sachets_$0.77_01021170,Promoted,B0824GK8BP,$24.92,1,1,$24.92,1,1,100.00%,100.00%,100.00%,CPC,$24.92,1,1
"Feb 27, 2026",USD,Brain Tea SB Bulk_mct tea_$0.66_01021160,Promoted,B0824GK8BP,$27.69,1,1,$0.0,0,0,0.00%,0.00%,0.00%,CPC,$27.69,1,1
"Feb 27, 2026",USD,Brain Tea SB Bulk_focus tea_$0.66_01021160,Promoted,B0824GK8BP,$27.69,1,1,$27.69,1,1,100.00%,100.00%,100.00%,CPC,$27.69,1,1
"Feb 28, 2026",USD,Brain Tea SB Bulk_daily herbal tea_$0.66_01021160,Promoted,B0CRZRHT7R,$19.43,1,1,$0.0,0,0,0.00%,0.00%,0.00%,CPC,$19.43,1,1
"Feb 28, 2026",USD,Brain Tea SB Bulk_yerba mate tea bag_$0.66_01021160,Promoted,B0824GK8BP,$27.69,1,1,$27.69,1,1,100.00%,100.00%,100.00%,CPC,$27.69,1,1
"Feb 28, 2026",USD,Brain Tea SB Bulk_mct tea_$0.66_01021160,Promoted,B0CRZRHT7R,$19.43,1,1,$19.43,1,1,100.00%,100.00%,100.00%,CPC,$19.43,1,1
"Mar 1, 2026",USD,Brain Tea SB New_vegan brain tea blend_$0.77_01021170,Promoted,B0CRZRHT7R,$19.43,1,1,$19.43,1,1,100.00%,100.00%,100.00%,CPC,$19.43,1,1
"Mar 1, 2026",USD,Brain Tea SB Bulk_daily herbal tea_$0.66_01021160,Promoted,B0824GK8BP,$27.69,1,1,$27.69,1,1,100.00%,100.00%,100.00%,CPC,$27.69,1,1
"Mar 2, 2026",USD,Brain Tea SB New_instant brain tea powder_$0.77_01021170,Promoted,B0824GK8BP,$27.69,1,1,$27.69,1,1,100.00%,100.00%,100.00%,CPC,$27.69,1,1
"Mar 2, 2026",USD,SB_Brain Tea_brain tea infusion_66_ERIC,Promoted,B0824GK8BP,$27.69,1,1,$27.69,1,1,100.00%,100.00%,100.00%,CPC,$27.69,1,1
"Mar 3, 2026",USD,BTFM - B0824GK8BP - K5-JSC0-HUPB - SBV PT - Replication SKC - B0CV61W2TQ - 20251025 - MV,Promoted,B0824GK8BP,$27.69,1,1,$27.69,1,1,100.00%,100.00%,100.00%,CPC,$27.69,1,1
"Mar 4, 2026",USD,Brain Tea SB Bulk_brain tea_$0.66_01021160,Promoted,B0824GK8BP,$55.38,2,2,$27.69,1,1,50.00%,50.00%,50.00%,CPC,$55.38,2,2
"Mar 4, 2026",USD,Brain Tea SB New_teen focus tea_$0.77_01021170,Promoted,B0824GK8BP,$27.69,1,1,$0.0,0,0,0.00%,0.00%,0.00%,CPC,$27.69,1,1
"Mar 4, 2026",USD,SB_Brain Tea_peppermint focus tea_67_ERIC,Promoted,B0CRZRHT7R,$19.43,1,1,$19.43,1,1,100.00%,100.00%,100.00%,CPC,$19.43,1,1
"Mar 5, 2026",USD,SB_Brain Tea_virgin brain tea_67_ERIC,Promoted,B0CRZRHT7R,$19.43,1,1,$19.43,1,1,100.00%,100.00%,100.00%,CPC,$19.43,1,1
"Mar 6, 2026",USD,SB_Brain Tea_brain tea elixir_68_ERIC,Promoted,B0824GK8BP,$27.69,1,1,$27.69,1,1,100.00%,100.00%,100.00%,CPC,$27.69,1,1
"Mar 7, 2026",USD,SB_Brain Tea_lions mane extract tea_68_ERIC,Promoted,B0824GK8BP,$27.69,1,1,$27.69,1,1,100.00%,100.00%,100.00%,CPC,$27.69,1,1
"Mar 7, 2026",USD,SB_Brain Tea_brain injury tea_68_ERIC,Promoted,B0824GK8BP,$27.69,1,1,$27.69,1,1,100.00%,100.00%,100.00%,CPC,$27.69,1,1
"Mar 7, 2026",USD,BTF - B0824GK8BP - K5-JSC0-HUPB - SBV E - Rank SKC - brain tea - 20250622 - MV,Promoted,B0824GK8BP,$27.69,1,1,$27.69,1,1,100.00%,100.00%,100.00%,CPC,$27.69,1,1
